{
  "schema_version": "1.0",
  "policy_id": "screen.ocr.local.default",
  "policy_version": "1",
  "sensor_id": "screen.ocr",
  "purpose": "screen_text_observation",
  "consent_state": "not_granted",
  "capture_mode": "disabled",
  "request_id": null,
  "global_pause": false,
  "region_of_interest": null,
  "redaction_version": "length-only-v1",
  "text_retention_days": 7,
  "visual_retention_days": 30,
  "event_payload_mode": "reference-and-hash-only"
}
